{
  "id": "freight-depot-01",
  "name": "Freight Depot",
  "building": {
    "id": "freight-depot-main",
    "scene": "buildings/freight_depot.tscn"
  },
  "spawns": {
    "playerA": {
      "position": [0.0, 1.0, -18.0],
      "rotation": [0, 0, 0]
    },
    "playerB": {
      "position": [0.0, 1.0, 18.0],
      "rotation": [0, 180, 0]
    }
  },
  "rules": {
    "roundTimeLimitSec": 300,
    "photoCooldownSec": 2.0,
    "maxPhotoDistance": 60.0,
    "minPhotoDistance": 1.0,
    "requireAimMode": false,
    "requireBodyInFrame": true,
    "exposure": {
      "flash": true,
      "sound": true,
      "soundAudibleRadius": 25.0,
      "flashVisibleRadius": 40.0,
      "flashDurationSec": 0.15
    }
  }
}
